{
  "$schema": "https://json-schema.org/draft/2020-12/schema",
  "type": "object",
  "additionalProperties": false,
  "required": ["schema_version","record_type","registry_id","tracker_issue","implementation_authorization","protected_registration","contracts","state","controls","activation","successor_sequence","claim_boundary"],
  "properties": {
    "schema_version":{"const":"1.0.0"},
    "record_type":{"const":"openai_ten_proofs_sphere_packing_adjudication_contract_registry"},
    "registry_id":{"const":"MC-OPENAI-TEN-PROOFS-A-SPHERE-PACKING-ADJUDICATION-CONTRACT"},
    "tracker_issue":{"const":"https://github.com/grandchallenge/MATHCERT/issues/160"},
    "implementation_authorization":{"type":"object","additionalProperties":false,"required":["comment_id","scope"],"properties":{"comment_id":{"const":5337465770},"scope":{"const":"design_only_sphere_packing_adjudication_contract"}}},
    "protected_registration":{"type":"object","additionalProperties":false,"required":["merge_commit","route_registry_blob","registration_receipt_blob"],"properties":{"merge_commit":{"const":"7179ed9c6060f44e46fb821a569e2c0c2f75c215"},"route_registry_blob":{"const":"b9bb0dc9e18856f50a88162df37c20c034327439"},"registration_receipt_blob":{"const":"2d9a520a3ef868c4d6d721cffc6cf89e546c6d09"}}},
    "contracts":{"type":"array","minItems":1,"maxItems":1,"prefixItems":[{"type":"object","additionalProperties":false,"required":["contract_id","result_family","route_id","contract","contract_state","may_adjudicate","adjudication","cert_output","mathematical_target_proved","may_promote_claim"],"properties":{"contract_id":{"const":"MC-OTP-ADJUDICATION-CONTRACT-A-SPHERE-PACKING"},"result_family":{"const":"OTP-A-SPHERE-PACKING"},"route_id":{"const":"MC-ROUTE-OTP-A-SPHERE-PACKING"},"contract":{"type":"object","additionalProperties":false,"required":["path","digest_algorithm","digest"],"properties":{"path":{"const":"governance/result_family_adjudication_contracts/OTP-A-SPHERE-PACKING.json"},"digest_algorithm":{"const":"git_blob_sha1"},"digest":{"type":"string","pattern":"^[0-9a-f]{40}$"}}},"contract_state":{"const":"design_only"},"may_adjudicate":{"const":false},"adjudication":{"type":"null"},"cert_output":{"type":"null"},"mathematical_target_proved":{"const":false},"may_promote_claim":{"const":false}}}],"items":false},
    "state":{"type":"object","additionalProperties":false,"required":["contract_count","design_only_contract_count","may_adjudicate_count","adjudication_count","cert_output_count","mathematical_target_proved_count","aggregate_adjudication_count"],"properties":{"contract_count":{"const":1},"design_only_contract_count":{"const":1},"may_adjudicate_count":{"const":0},"adjudication_count":{"const":0},"cert_output_count":{"const":0},"mathematical_target_proved_count":{"const":0},"aggregate_adjudication_count":{"const":0}}},
    "controls":{"type":"object","additionalProperties":false,"required":["registered_route_must_remain_submitted","registered_route_registry_must_remain_exact_blob","contract_outside_executed_adjudication_registry","target_and_classification_drift_prohibited","manuscript_decimal_precision_inflation_prohibited","scale_normalization_erasure_prohibited","composite_as_verbatim_reclassification_prohibited","whole_chapter_or_proof_body_equivalence_inflation_prohibited","aggregate_adjudication_prohibited","other_family_expansion_prohibited","historical_record_rewrite_prohibited","may_adjudicate","may_issue_cert_output","may_mark_target_proved","may_promote_claim"],"properties":{"registered_route_must_remain_submitted":{"const":true},"registered_route_registry_must_remain_exact_blob":{"const":true},"contract_outside_executed_adjudication_registry":{"const":true},"target_and_classification_drift_prohibited":{"const":true},"manuscript_decimal_precision_inflation_prohibited":{"const":true},"scale_normalization_erasure_prohibited":{"const":true},"composite_as_verbatim_reclassification_prohibited":{"const":true},"whole_chapter_or_proof_body_equivalence_inflation_prohibited":{"const":true},"aggregate_adjudication_prohibited":{"const":true},"other_family_expansion_prohibited":{"const":true},"historical_record_rewrite_prohibited":{"const":true},"may_adjudicate":{"const":false},"may_issue_cert_output":{"const":false},"may_mark_target_proved":{"const":false},"may_promote_claim":{"const":false}}},
    "activation":{"type":"object","additionalProperties":false,"required":["condition","head_change_requires_revalidation_and_reapproval","design_merge_effect","later_execution_requires_separate_human_steward_authorization"],"properties":{"condition":{"type":"string","minLength":120},"head_change_requires_revalidation_and_reapproval":{"const":true},"design_merge_effect":{"const":"contract_admitted_design_only_no_adjudication"},"later_execution_requires_separate_human_steward_authorization":{"const":true}}},
    "successor_sequence":{"type":"array","minItems":5,"maxItems":5,"prefixItems":[{"const":"adjudication_execution_input"},{"const":"exact_head_machine_gates"},{"const":"fresh_non_author_specialist_review"},{"const":"human_steward_execution_authorization"},{"const":"separate_adjudication_execution"}],"items":false},
    "claim_boundary":{"type":"string","minLength":220}
  }
}
